{
  "$schema": "http://json-schema.org/draft-07/schema#",
  "title": "Fiche personnage D&D 3.5",
  "description": "Schema JSON d'une fiche personnage persistante, conforme au Manuel du Joueur D&D 3.5. Utilise par le tool Outil_FichesPerso.",
  "type": "object",
  "required": ["nom", "race", "classe", "niveau", "carac", "pv", "pv_max", "ca", "sauvegardes", "bab"],
  "properties": {
    "nom": {"type": "string", "description": "Nom complet du personnage."},
    "joueur": {"type": "string", "description": "Nom du joueur humain qui incarne ce personnage."},
    "race": {"type": "string", "description": "Race D&D 3.5 (avec sous-race eventuelle)."},
    "classe": {"type": "string", "description": "Classe (et classe de prestige eventuelle)."},
    "niveau": {"type": "integer", "minimum": 1, "description": "Niveau total du personnage."},
    "carac": {
      "type": "object",
      "description": "Caracteristiques D&D 3.5 (valeur brute, 3-18 typique).",
      "properties": {
        "FOR": {"type": "integer"}, "DEX": {"type": "integer"}, "CON": {"type": "integer"},
        "INT": {"type": "integer"}, "SAG": {"type": "integer"}, "CHA": {"type": "integer"}
      },
      "required": ["FOR", "DEX", "CON", "INT", "SAG", "CHA"]
    },
    "pv": {"type": "integer", "minimum": -10, "description": "Points de vie actuels. Peut descendre sous 0 : mourant entre -1 et -9, mort a -10 (regles officielles Injury and Death 3.5)."},
    "pv_max": {"type": "integer", "minimum": 1, "description": "Points de vie maximaux."},
    "ca": {"type": "integer", "description": "Classe d'Armure (CA)."},
    "sauvegardes": {
      "type": "object",
      "properties": {
        "Vigueur": {"type": "integer"},
        "Reflexes": {"type": "integer"},
        "Volonte": {"type": "integer"}
      },
      "required": ["Vigueur", "Reflexes", "Volonte"]
    },
    "bab": {"type": "integer", "description": "Bonus de Base a l'Attaque."},
    "competences": {
      "type": "object",
      "description": "Map nom de competence -> rangs attribues.",
      "additionalProperties": {"type": "number"}
    },
    "dons": {"type": "array", "items": {"type": "string"}, "description": "Liste des dons acquis."},
    "sorts": {
      "type": "object",
      "description": "Magie du personnage : connus (liste de noms), prepares (dict nom -> nombre prépare du jour), depenses (dict niveau de sort -> emplacements utilisés).",
      "additionalProperties": true
    },
    "equipement": {
      "type": "array",
      "description": "Objets transportes.",
      "items": {
        "type": "object",
        "properties": {"nom": {"type": "string"}, "qte": {"type": "integer"}},
        "required": ["nom"],
        "description": "Chaque objet DOIT avoir un champ 'nom' (texte) — pas de nom-porte-clé du type {'clé_de_fer': 1}."
      }
    },
    "inventaire": {
      "type": "array",
      "description": "Inventaire structuré suivi mécaniquement (poids par unité pour le calcul d'encombrement).",
      "items": {
        "type": "object",
        "properties": {
          "nom": {"type": "string"},
          "qte": {"type": "integer"},
          "poids": {"type": "number", "description": "Poids en kg d'une unite (depuis le catalogue PHB ou fourni)."}
        },
        "required": ["nom"],
        "description": "Chaque objet DOIT avoir un champ 'nom' (texte)."
      }
    },
    "poids_transporte": {"type": "number", "description": "Poids total transporte en kg (recalcule a chaque inventaire)."},
    "etat_encumbrance": {
      "type": "string",
      "description": "Categorie d'encombrement D&D 3.5 : Legere / Moyenne / Lourde / Depassee.",
      "enum": ["Legere", "Moyenne", "Lourde", "Depassee"]
    },
    "charge_max": {"type": "integer", "description": "Charge maximale transportable en kg (table PHB 3.5)."},
    "or": {"type": "integer", "description": "Or en pieces de cuivre (pc).", "default": 0},
    "xp": {"type": "integer", "description": "Experience cumulee (DMG 3.5). Niveau N = N*(N-1)/2*1000 XP minimum ; montee automatique avec jet de de de vie.", "minimum": 0, "default": 0},
    "niveaux_negatifs": {"type": "integer", "description": "Niveaux negatifs cumules (energy drain). Niveau effectif = niveau - niveaux_negatifs ; mort si <= 0.", "minimum": 0, "default": 0},
    "alignement": {"type": "string", "description": "Alignement D&D, ex. 'Loyal Bon'."},
    "histoire": {"type": "string", "description": "Background roleplay libre."},
    "conditions": {"type": "array", "items": {"type": "string"}, "description": "Conditions D&D 3.5 actives."},
    "familier": {
      "type": "object",
      "description": "Familier (Magicien/Sorcier, PHB p.60/64) ou compagnon animal (Druide/Rodeur, PHB p.48) choisi a la creation.",
      "properties": {
        "type": {"type": "string", "enum": ["familier", "compagnon"], "description": "Type de lien : familier (arcane) ou compagnon animal (nature)."},
        "espece": {"type": "string", "description": "Nom canonique de l'espece (ex. « Chat », « Serpent venimeux (petit) »)."},
        "invoque": {"type": "boolean", "description": "True une fois l'appel effectue en jeu (rituel 100 po / 24 h pour le familier)."}
      },
      "required": ["type", "espece"]
    }
  }
}
